{"schema_version":1,"snapshot_id":"0192a000-0000-7000-8000-0000000000f2","simulation_id":"0192a000-0000-7000-8000-0000000000f1","tenant_ref":"0192a000-0000-7000-8000-0000000000e1","algorithm_version":"agrigreen-optimizer/2026.09.24+py.1","network_version":"ww-example-1","created_at":"2026-09-29T03:00:00Z","scenario":{"scenario_id":"0192a000-0000-7000-8000-0000000000a1","code":"KB-0001","lifecycle_years":10,"discounted":false,"baseline_mode":"no_hub","baseline_manual_cost_per_ton":null,"baseline_scenario_id":null,"baseline_scenario_cost_per_ton":null,"plant":{"plant_ref":null,"annual_demand_tons":null}},"hubs":[{"scenario_hub_id":"0192a000-0000-7000-8000-0000000000b1","hub_ref":"0192a000-0000-7000-8000-0000000000d1","code":"HUB-0001","sort_order":1,"service_radius_km":"25","design_capacity_tons":"30000","barge_payload_tons":"2000","mode_field_hub":"auto","mode_hub_plant":"waterway","land_mode":"thue"},{"scenario_hub_id":"0192a000-0000-7000-8000-0000000000b2","hub_ref":"0192a000-0000-7000-8000-0000000000d2","code":"HUB-0002","sort_order":2,"service_radius_km":"20","design_capacity_tons":"20000","barge_payload_tons":null,"mode_field_hub":"auto","mode_hub_plant":"auto","land_mode":"mua"}],"cooperatives":[{"cooperative_ref":"0192a000-0000-7000-8000-00000000c001","member_count":120,"seasons":[{"season_key":"DX-2026","paddy_tons":"9000","planted_area_ha":"1500"},{"season_key":"HT-2026","paddy_tons":"8000","planted_area_ha":"1333.3"},{"season_key":"TD-2026","paddy_tons":"5000","planted_area_ha":"833.3"}]},{"cooperative_ref":"0192a000-0000-7000-8000-00000000c002","member_count":80,"seasons":[{"season_key":"DX-2026","paddy_tons":"6000","planted_area_ha":"1000"},{"season_key":"HT-2026","paddy_tons":"5500","planted_area_ha":"916.7"},{"season_key":"TD-2026","paddy_tons":"3000","planted_area_ha":"500"}]},{"cooperative_ref":"0192a000-0000-7000-8000-00000000c003","member_count":95,"seasons":[{"season_key":"DX-2026","paddy_tons":"7000","planted_area_ha":"1166.7"},{"season_key":"HT-2026","paddy_tons":"6500","planted_area_ha":"1083.3"},{"season_key":"TD-2026","paddy_tons":"0","planted_area_ha":"0"}]}],"seasons":[{"season_key":"DX-2026","season_type":"DX","end_month":3,"sort_order":1},{"season_key":"HT-2026","season_type":"HT","end_month":8,"sort_order":2},{"season_key":"TD-2026","season_type":"TD","end_month":12,"sort_order":3}],"harvest_observations":{"DX":[{"day_of_year":62,"tons":"4000"},{"day_of_year":69,"tons":"9000"}]},"radius":[{"cooperative_ref":"0192a000-0000-7000-8000-00000000c001","hub_ref":"0192a000-0000-7000-8000-0000000000d1","radius_km":"5.86819399020136"},{"cooperative_ref":"0192a000-0000-7000-8000-00000000c002","hub_ref":"0192a000-0000-7000-8000-0000000000d1","radius_km":"9.684532812614236"},{"cooperative_ref":"0192a000-0000-7000-8000-00000000c001","hub_ref":"0192a000-0000-7000-8000-0000000000d2","radius_km":"19.11490044363542"},{"cooperative_ref":"0192a000-0000-7000-8000-00000000c003","hub_ref":"0192a000-0000-7000-8000-0000000000d2","radius_km":"2.4533664573337775"}],"routes":[{"from":"hub:0192a000-0000-7000-8000-0000000000d1","to":"plant","mode":"road","distance_km":"194.802","source":"haversine_hieu_chinh","straight_km":"149.84781327775883"},{"from":"hub:0192a000-0000-7000-8000-0000000000d1","to":"plant","mode":"waterway","distance_km":"209.787","source":"tuyen_so_hoa_noi_bo","waterway_access":true},{"from":"coop:0192a000-0000-7000-8000-00000000c001","to":"hub:0192a000-0000-7000-8000-0000000000d1","mode":"road","distance_km":"7.629","source":"haversine_hieu_chinh","straight_km":"5.86819399020136"},{"from":"coop:0192a000-0000-7000-8000-00000000c001","to":"hub:0192a000-0000-7000-8000-0000000000d1","mode":"waterway","distance_km":"8.215","source":"tuyen_so_hoa_noi_bo","waterway_access":true},{"from":"coop:0192a000-0000-7000-8000-00000000c002","to":"hub:0192a000-0000-7000-8000-0000000000d1","mode":"road","distance_km":"12.59","source":"haversine_hieu_chinh","straight_km":"9.684532812614236"},{"from":"coop:0192a000-0000-7000-8000-00000000c002","to":"hub:0192a000-0000-7000-8000-0000000000d1","mode":"waterway","distance_km":"13.558","source":"tuyen_so_hoa_noi_bo","waterway_access":true},{"from":"hub:0192a000-0000-7000-8000-0000000000d2","to":"plant","mode":"road","distance_km":"163.454","source":"haversine_hieu_chinh","straight_km":"125.73421122912147"},{"from":"hub:0192a000-0000-7000-8000-0000000000d2","to":"plant","mode":"waterway","distance_km":"176.028","source":"tuyen_so_hoa_noi_bo","waterway_access":true},{"from":"coop:0192a000-0000-7000-8000-00000000c001","to":"hub:0192a000-0000-7000-8000-0000000000d2","mode":"road","distance_km":"24.849","source":"haversine_hieu_chinh","straight_km":"19.11490044363542"},{"from":"coop:0192a000-0000-7000-8000-00000000c001","to":"hub:0192a000-0000-7000-8000-0000000000d2","mode":"waterway","distance_km":"26.761","source":"tuyen_so_hoa_noi_bo","waterway_access":true},{"from":"coop:0192a000-0000-7000-8000-00000000c003","to":"hub:0192a000-0000-7000-8000-0000000000d2","mode":"road","distance_km":"3.189","source":"haversine_hieu_chinh","straight_km":"2.4533664573337775"},{"from":"coop:0192a000-0000-7000-8000-00000000c003","to":"hub:0192a000-0000-7000-8000-0000000000d2","mode":"waterway","distance_km":"3.435","source":"tuyen_so_hoa_noi_bo","waterway_access":true},{"from":"coop:0192a000-0000-7000-8000-00000000c001","to":"plant","mode":"road","distance_km":"188.004","source":"haversine_hieu_chinh","straight_km":"144.61861721264296"},{"from":"coop:0192a000-0000-7000-8000-00000000c001","to":"plant","mode":"waterway","distance_km":"202.466","source":"tuyen_so_hoa_noi_bo","waterway_access":true},{"from":"coop:0192a000-0000-7000-8000-00000000c002","to":"plant","mode":"road","distance_km":"204.061","source":"haversine_hieu_chinh","straight_km":"156.97007217700653"},{"from":"coop:0192a000-0000-7000-8000-00000000c002","to":"plant","mode":"waterway","distance_km":"219.758","source":"tuyen_so_hoa_noi_bo","waterway_access":true},{"from":"coop:0192a000-0000-7000-8000-00000000c003","to":"plant","mode":"road","distance_km":"160.273","source":"haversine_hieu_chinh","straight_km":"123.28680615331177"},{"from":"coop:0192a000-0000-7000-8000-00000000c003","to":"plant","mode":"waterway","distance_km":"172.602","source":"tuyen_so_hoa_noi_bo","waterway_access":true}],"params":{"set_version":"825b4ad8d902018dc80adee5ba47177de6a4c4c043b2b43f7f00aea638596dc9","all_approved":true,"unapproved":[],"values":[{"code":"admin_boundaries","number":1,"name":"Ranh giới tỉnh/thành sau sáp nhập (2025)","classification":"thi_truong","value":null,"text_value":null,"min":null,"max":null,"approved":false,"param_version":null},{"code":"htx_directory","number":2,"name":"Danh sách hợp tác xã (tên, địa bàn)","classification":"thi_truong","value":null,"text_value":null,"min":null,"max":null,"approved":false,"param_version":null},{"code":"htx_coordinates","number":3,"name":"Toạ độ GPS của từng HTX/vùng nguyên liệu","classification":"thi_truong","value":null,"text_value":null,"min":null,"max":null,"approved":false,"param_version":null},{"code":"planted_area","number":4,"name":"Diện tích gieo trồng theo HTX/vùng","classification":"thi_truong","value":null,"text_value":null,"min":null,"max":null,"approved":false,"param_version":null},{"code":"paddy_output","number":5,"name":"Sản lượng lúa theo HTX/vùng/mùa vụ","classification":"thi_truong","value":null,"text_value":null,"min":null,"max":null,"approved":false,"param_version":null},{"code":"farmer_count","number":6,"name":"Số nông hộ liên kết theo HTX","classification":"thi_truong","value":null,"text_value":null,"min":null,"max":null,"approved":false,"param_version":null},{"code":"season_calendar","number":7,"name":"Lịch mùa vụ (Đông Xuân / Hè Thu / Thu Đông)","classification":"thi_truong","value":null,"text_value":null,"min":null,"max":null,"approved":false,"param_version":null},{"code":"leg_distances","number":8,"name":"Khoảng cách Field→Hub, Hub→Plant và Field→Plant","classification":"thi_truong","value":null,"text_value":null,"min":null,"max":null,"approved":false,"param_version":null},{"code":"waterway_network","number":9,"name":"Mạng lưới đường thủy/kênh rạch lưu thông được cho sà lan","classification":"gia_dinh","value":null,"text_value":null,"min":null,"max":null,"approved":false,"param_version":null},{"code":"distance_correction","number":10,"name":"Hệ số hiệu chỉnh khoảng cách (Haversine → thực tế) theo phương thức","classification":"gia_dinh","value":"1.3","text_value":{"road":"1.3","waterway":"1.45"},"min":"1.15","max":"1.5","approved":true,"param_version":1},{"code":"plant_coordinates","number":11,"name":"Toạ độ GPS Nhà máy VFT","classification":"khac","value":null,"text_value":null,"min":null,"max":null,"approved":false,"param_version":null},{"code":"plant_annual_demand","number":12,"name":"Nhu cầu rơm hàng năm của Nhà máy VFT","classification":"thi_truong","value":"240000","text_value":null,"min":"180000","max":"300000","approved":true,"param_version":1},{"code":"default_service_radius_km","number":13,"name":"Bán kính phục vụ mặc định cho Hub mới","classification":"gia_dinh","value":"30","text_value":null,"min":"20","max":"45","approved":true,"param_version":1},{"code":"default_design_capacity_tons","number":14,"name":"Công suất thiết kế mặc định cho Hub mới","classification":"gia_dinh","value":"60000","text_value":null,"min":"40000","max":"90000","approved":true,"param_version":1},{"code":"distance_error_threshold_pct","number":15,"name":"Ngưỡng sai số khoảng cách chấp nhận được","classification":"gia_dinh","value":"10","text_value":null,"min":"5","max":"15","approved":true,"param_version":1},{"code":"hub_coordinates","number":16,"name":"Toạ độ vị trí Hub ứng viên","classification":"khac","value":null,"text_value":null,"min":null,"max":null,"approved":false,"param_version":null},{"code":"straw_to_paddy_ratio","number":17,"name":"Hệ số rơm/lúa (tỷ lệ phụ phẩm)","classification":"gia_dinh","value":"1","text_value":null,"min":"0.9","max":"1.35","approved":true,"param_versio